video_id,title,view_count,duration_seconds
RHMxddxSEd8,"BEST OF BILL MAHER(kyle dunnigan) on Kill Tony 3 minutes, 30 seconds",,210
rch-9E9qJ5E,Bill Maher IS DONE With Radicals: Your Ideas Are Stupid!,3341667,30
ISK-9jWZtmM,Ann Coulter Roasts Hypocritical Bill Maher,257970,60
HhVIo9PeEWE,Even Bill Maher Wasn't Ready For This Answer 😂,8646216,29
1gGVl-9QHXw,"24 Things You Don't Know About Nick Fuentes | Real Time with Bill Maher (HBO) 2 minutes, 55 seconds",,175
MNcDUDBQL5w,Bill Maher CALLS OUT The Dems AGAIN! It never gets old!,22793,60
SLmPpJPP6gM,Joe Rogan Reacts To Bill Maher Destroying CNN Guest,1401988,22
dCM1U7PwTc4,Bill Maher HUMILIATES Democrats like Hillary & Kamala for being too scared to come on his show,111943,36
mS6aWd4CoA0,Bill Maher Your Ideas Are Stupid #impression #billmaher #funny #democrats #cnn #realtime,3281,10
8wsViRMR3Ko,Kyle Dunnigan’s Bill Maher is Impression is HILARIOUS‼️🤣 #kyledunnigan #billmaher #kt709 #killtony,175109,60
Q1mK9D3YDow,Bill Maher and Jim Carrey on Donald Trump #trump #funny #politics #jimcarrey #billmaher,29242,29
dkzKlTWJgBo,Joe Rogan Reacts To Dr. Phill Destroyed Bill Maher,319636,19
6_rCbgnPVOw,Comedian Matt Friend does hilarious Bill Maher impression after dinner with Trump #trump #comedy,68828,27
oxiYLadVyQo,Bill Maher LOVES This Movie #politics #funny #realtime #apocalypto #movie #film #billmaher #comedian,4773,18
-xEw-SdaVJ0,Bill Maher Crushes Woke Culture,1573460,50
U-p2biSpVq4,Bill Maher explains what’s wrong with The Left. #billmaher #funny,12718,39
i7rG1Mz-Bm4,Bill Maher Shocked By Whitney Cummings ￼,1097905,32
qp0IgnjaLRY,"Bill Maher & Rob Reiner on RFK Jr.: Science, Choice & Cheryl Hines #shorts",34555,180
QFY_oqF1yOY,Bill Maher Quizzes Woody Allen: Godfather & James Bond — Pass or Fail? #shorts,244605,148
BDk7Xesvn3A,Five Funny Trump Reactions in Meeting with Bill Maher,43152,58
RHMxddxSEd8,"BEST OF BILL MAHER(kyle dunnigan) on Kill Tony 3 minutes, 30 seconds",,210
HhVIo9PeEWE,Even Bill Maher Wasn't Ready For This Answer 😂,8646861,29
qioV6GYNsG4,RFk JR. left Bill Maher speechless after this one #shorts,5511960,26
kmJzfUejIlU,BASED Bill Maher ROASTS woke Dems on why they lost to Trump,4766905,57
QO3hbm16n4E,Steve Bannon tells Bill Maher that Trump WILL Serve a Third Term.,9224959,58
oaiSZaEct18,Bill Maher Does Not HOLD BACK! #shorts,5031581,83
eB2Gz06CKIo,Bill Maher Got Hit With Facts He Couldn’t Argue With! #shorts,5415523,137
y9TRCHqR6uw,Things Got Real With Roddy Piper and Bill Maher #wwe #aew #shorts,3885029,60
VSoKvSJyrYo,"\""Modi is Holding Hands with the Other Guy\"": US Media Meltdown Over India's Power!",5151880,60
il3ocXx7CHw,Part 1- Club Random | Bill Maher & Charlie Kirk | May Charlie Kirk rest in peace. See description.,5567691,15
RYLxyCsrY4A,Bill Maher’s Return to Common Sense,4759936,32
rch-9E9qJ5E,Bill Maher IS DONE With Radicals: Your Ideas Are Stupid!,3341667,30
Limdg6GWLZI,She STUNNED Bill Maher With This Response,1697748,22
p5ojxMtxjGI,Real Time' Crowd Goes Quiet as Bill Maher Explains Why Dems Can’t Win,2435818,146
shlK02iCuzY,Conservative Mom STUNNED Bill Maher,2914790,44
8dtpcOXCZwU,Bill Maher Takes a SLEDGEHAMMER to Democrats!,2689770,43
SaXGtDPaYgA,Young Congressman SCHOOLS Bill Maher,2636907,42
rGqc08VihOI,Bill Maher Takes a Savage Dig at Woke Culture 😳🔥,2175664,56
rlr6JyITzHM,This Fight Over Bill Maher Was So Big It Could Be the End of This Host of 'The View',1266245,58
SK02j70DcPY,Joe Rogan Reacts to Bill Maher Talking About Trump,2105875,57
l_S0_4T-DuQ,Bill Maher Can’t Ignore This Anymore,2184545,27
