video_id,title,view_count,duration_seconds
pcYA9RfiEKw,Influenceless influencer #KattWilliams,127432,50
yZv7qugmBf4,Jeff Ross roasts Elon Musk #Torching2024,148808,22
X8fc7UTrQjA,Getting older is hard #NateBargatze,193639,23
CpUUEqQFcME,The messaging is unclear #RonnyChieng,336263,37
JUV4UzTW8Rs,Turns out history is pretty crazy #NateBargatze,604297,38
avoMqCl8giM,same boat #DeRayDavis,22518,16
zu0v1tKEXlg,"\""Fluffy found in field\"" #GabrielIglesias #Fluffy",107253,71
Yh0tw4avAj4,3 laughs. 30K people. Still got paid #DaveChappelle,193734,28
DeG5ffdVpZg,BREAKING: Dr. Phil finally reveals his favorite color #AdamRay #DrPhil,295290,39
jGq1udkAwEs,Urban Genius | Dave Chappelle #comedian #funny,6704667,60
0jCKom16EoY,Bill Burr knows how to drop a compliment #ConanObrien #BillBurr #MarkTwainPrize,947878,58
WNMScyuMY5I,Raising a Boy VS a Girl… The TRUTH No One Tells You  #standupcomedy #comedy,251254,63
c4hXljepVeY,the day white people stopped being cool. #ShaneGillis,155734,90
p1IG4hFWwtI,Katt Williams. White People 😮 #comedy #standupcomedy #funny,4064332,56
cM8sDleh55g,Us Italians don’t send food back we fix it… pepper… some oil… BOOM Michelin Star,1329829,14
M4egvtiFkl8,Total Conan move #ConanObrien #WillFerrell #MarkTwainPrize,1363298,59
9dGOHLwawWA,American Pharmacist | Sebastian Maniscalco,785171,50
qiAlQebKuZo,What Happens If The Mexicans Leave America? | Eddie Griffin,1539458,32
EXlvjyC0hzo,El Salvador Is Our Mexico | Ralph Barbosa #standupcomedy #RalphBarbosa #mexico #elsalvador #joke,1372245,30
VQUEBX3LuTU,Dave Chappelle and wife out in NYC #celebrity #comedy #davechappelle,407026,9
K908TsWH9JI,Dave Chappelle | The first time i bought a gun #shorts,20134655,130
QQ8ZN46Val4,"\""My dad died watching your special!\"" #jimmycarr #standupcomedy #hecklers #crowdwork",8364037,78
jGq1udkAwEs,Urban Genius | Dave Chappelle #comedian #funny,6704667,60
13Viop0fz5s,480 Months ⛓️ RENE VACA,4827509,28
fg1mCyiUo30,UK vs America,5900691,101
p1IG4hFWwtI,Katt Williams. White People 😮 #comedy #standupcomedy #funny,4064332,56
haYEZpXnC5o,"“RoadHead” ⁉️🤣 | KillTony, ft. Fiona Cauley #killtony #comedy #funny",5386155,60
dWpDeaEjMkI,Jimmy Carr's Top 5 DARKEST Jokes #shorts #funny #comedy #humor #dark #youtubeshorts #youtube,6058310,87
-vZE7ZTByjE,It’s hard to pronounce the letter S when you have water in your mouth. | Anjelah Johnson-Reyes,4635659,60
s9zTJ763IO0,Norm Macdonald On Hitler Having A Dog... #funny #comedy #jokes #standupcomedy #comedian #shorts,5265566,68
g3Xta6QVOOo,Gurleen Pannnu & Ludo 🎲 | Comicstaan | #primevideoindia,3872104,60
U40I6p5MVtA,Timmy No Brakes is taking Kill Tony,4579348,178
RnDByBdQL5s,Legendary Theo Von Joke🤣🤣🤣#theovon #standupcomedy #thispastweekend #comedy #theovonmoments,5614275,18
-rEhoAGxEzA,Achmed LOVES Abu Dhabi! | JEFF DUNHAM,5158897,61
WOYVFysY-WA,How To Overcome Addiction | John Mulaney #comedian #funny,2757157,60
bUFjWXFdWXg,Crazy that this video has over 25 Million views on TikTok! | Ali Siddiq Stand Up Comedy,1978675,90
vX4_Cv_jUJY,I’m a harrrddd workin maannnnn! | Dusty Slay: Wet Heat | Stand Up Comedy,2820416,177
OMoYymsDfXI,Norm Macdonald's Most Brutal Joke... #funny #comedy #standupcomedy #jokes #comedian #shorts,2394872,85
ijXmcMVSfcc,Let the race/class war begin…,1518476,76
BoQqRFM8r6A,Where To Go On The Dates After 60? | Leanne Morgan #comedian #standupcomedian,1816526,60
