video_id,title,view_count,duration_seconds
SPzXDVyqDr8,"Why doesn’t Gabriel Iglesias’ only son ever smile, even though he’s worth millions?#gabrieliglesias",4537365,60
bXOCtjWVYYg,FORE #comedy #funny #fluffy #funnyyoushouldask #trivia #gameshow #comedian #gabrieliglesias,6166,14
aSDFN-mzgFE,I Offended The Entire Audience In Five Seconds | Gabriel Iglesias #comedian #jokes,434356,60
XjsdnyYj4Gc,Fluffy's hilarious gun advice | Gabriel Iglesias,806339,110
zu0v1tKEXlg,"\""Fluffy found in field\"" #GabrielIglesias #Fluffy",107220,71
CHv0TGnwrxw,"I just wanted a bed, not a roast.",22207968,141
UNUpDczPTys,Fluffy Stand Up As A Baby #funny #comedian #baby #gabrieliglesias,5781,53
5pJCck8PLKM,GABRIEL IGLESIAS Best Moment On Stage 🥹 #shorts,4355326,57
_YFuwimETCo,Your Vocation Is Not To Sell Guns | Gabriel Iglesias #fluffy #comedyvideo,103720,60
NgkjaE2RFbI,It's George Lopez | Gabriel Iglesias,359416,147
--r7_yDKqEU,Stupid Robbers | Gabriel Iglesias #fluffy #standup,1039149,60
fg1mCyiUo30,UK vs America,5899795,101
KUS54RzwlM4,What Do You Gotta Say About That? | Gabriel Iglesias #fluffy #comedian,5401848,60
XDBB2nGnNbY,Two Kinds Of People | Gabriel Iglesias #fluffy #comedyvideo,121420,60
7oFIBh8ksw0,Fluffy a Disney fan | Gabriel Iglesias,1305185,91
7gnRr3o3AcI,I Wanted To Get Ghetto | Gabriel Iglesias #fluffy #standup,119274,59
wHtz99duyWU,And that’s on Fluffy math,11803035,52
x--9Cj1lgW0,Ranking Best Gabriel Iglesias Moments #shorts,88066,76
vChNPO0KsO4,McDonald's trip takes an unexpected turn | Gabriel Iglesias,2753329,73
d1Mb74E-8Sg,BABY GABRIEL IGLESIAS Hilarious Drive Through Moment!!! 🤣😂,25214,56
CHv0TGnwrxw,"I just wanted a bed, not a roast.",22207968,141
wHtz99duyWU,And that’s on Fluffy math,11803035,52
KUS54RzwlM4,What Do You Gotta Say About That? | Gabriel Iglesias #fluffy #comedian,5401848,60
fg1mCyiUo30,UK vs America,5899795,101
WZkDugSo1_8,Frankie Smokes with Snoop Dogg,7135197,138
NQ2j1jKysBs,Dialect can tell you a lot about Latinos.,5113964,101
L2_6TOCbtZE,Chihuahua  - What's This Dog?,3715711,79
Ow-pQxA2s4w,Chocolate Cake Shake,5671921,111
mTj6JVLJ01E,GABRIEL IGLESIAS First time in Chicago PT.2😂 #shorts,5482712,61
n82-3so9D54,Frankie gets payback…,4546912,122
u4ygQEKFKrc,Estonia Loves Gabriel Iglesias.. 😂😂 | Kill Tony ft. Ari Matti,4014346,60
5pJCck8PLKM,GABRIEL IGLESIAS Best Moment On Stage 🥹 #shorts,4355326,57
LV6Sowom8bM,Gun store comedy | Gabriel Iglesias,2949962,121
vChNPO0KsO4,McDonald's trip takes an unexpected turn | Gabriel Iglesias,2753329,73
r-gq7OP-Fmg,"Bad boys, bad boys, whatcha going to do..",1974651,132
YgGlQHRBB-A,$50K on the line for a tape no one’s supposed to see.,1166721,174
DVKr8xNs9Q8,Crocodile Hunter,1175654,128
7oFIBh8ksw0,Fluffy a Disney fan | Gabriel Iglesias,1305185,91
--r7_yDKqEU,Stupid Robbers | Gabriel Iglesias #fluffy #standup,1039149,60
7y-UPeVeR_0,First Gun | Gabriel Iglesias #comedian #jokes,870594,60
